{
  "schema_version": "sl0029-boatdesign-applicability-v1",
  "generated_at": "2026-08-27T13:00:00+00:00",
  "identity_model_reference": "specs/IDENTITY_MODEL.v0.2.md#2.4",
  "boat_models": [
    {
      "qid": "Q5051252",
      "hullq_id": "BM_WDT0_6c94b5bc9e79402bb07309289905913e",
      "preferred_label": "Catalina 22",
      "production_span_evidence": {
        "first_built": "1969-07",
        "last_built": null,
        "evidence": "Official history page: 'July 1969 -- Catalina's first model, the Catalina 22, is built in North Hollywood, CA.' Hull-number milestones: 'February 1975 -- The Catalina 22 exceeds Frank Butler's hopes to build 100 boats when hull number 5,000 is completed.'; 'September 1980 -- Catalina 22 hull number 10,000 is completed.'; 'February 1990 -- Catalina 22 hull number 15,000 is delivered.' last_built is not evidenced by the bounded pass (per the no-absence-as-proof rule this is reported as null/unknown, not assumed still-in-production or assumed ended)."
      },
      "candidate_generation_boundaries": [
        {
          "label": "Catalina 22 markII",
          "boundary_date": "1995-01",
          "evidence_class": "manufacturer_generation_redesign",
          "evidence": "Official history page, dated entry: 'January 1995 -- The Catalina 22 markII is introduced with re-designed and enlarged deck and new interior.'",
          "identity_model_criterion_matched": "IDENTITY_MODEL.v0.2.md 2.4 criterion 2 (evidence-backed manufacturer/designer generation redesign) and criterion 3 (persistent, non-optional production change with an identifiable production boundary: 1995-01).",
          "dimensional_impact_on_five_tier1_fields": "not_evidenced_by_this_pilot",
          "caution": "The history entry describes an 'enlarged deck and new interior' but does not itself state numeric LOA/LWL/beam/draft/displacement values for the markII configuration. This bounded pass did not locate a markII-specific specification document in the official brochure archive, so whether the five Tier-1 hull-dimension fields actually changed at this boundary is unresolved, not assumed unchanged."
        },
        {
          "label": "Catalina 22 Sport",
          "boundary_date": "2004-06",
          "evidence_class": "later_variant_matching_earlier_baseline",
          "evidence": "Official history page: 'June 2004 -- The Catalina 22 Sport is introduced to better accommodate one-design racing.' The 22Sport brochure itself (C22sBro.pdf) states it was built 'In response to Catalina 22 owners' requests for a production boat that more accurately reflects the original dimensions and weight of this popular one design boat' and explicitly invokes 'the first Catalina 22' and 'the thousands of first generation 22s'.",
          "identity_model_criterion_matched": "Named later variant with an identifiable introduction date (2004-06); the brochure's own text is evidence that its dimensions were deliberately set to match the pre-1995 (pre-markII) baseline rather than the markII baseline, but this is the manufacturer's marketing claim of intent, not an independently verified measurement comparison.",
          "dimensional_impact_on_five_tier1_fields": "22Sport brochure spec table: length of hull 6.55 m (21'6\"), length of waterline 5.89 m (19'4\"), beam 2.34 m (7'8\"), draft board-up 0.51 m (1'8\") / board-down 1.52 m (5'0\"), weight 1080 kg (2380 lbs). A separate 'length overall' figure of 7.25 m (23'10\") is also given, distinct from 'length of hull'.",
          "caution": "22Sport is itself a distinct later production run (2004+), not the same physical configuration as the 1969-1994 original run it claims to replicate. Its numbers are useful diagnostic evidence, not proof of the original/pre-1995 generation's own measured dimensions."
        }
      ],
      "excluded_related_products": [
        {
          "label": "Catalina Capri 22 / Catalina 22 Capri",
          "reason_excluded": "Distinct commercial product with its own hull-number series (official history: 'September 2002 -- Catalina Capri 22 Hull number 1000 is built in Woodland Hills, CA'), materially different dimensions (CC22Bro-05.pdf: length of hull 7.52 m/24'8\", length overall 6.71 m/22'0\", LWL 6.01 m/20'0\", beam 2.44 m/8'2\", fin/wing weight 999-1022 kg / 2200-2250 lbs, fin/wing draft 1.22 m/0.81 m), and its own official current-model page (sport-series/22-capri/) separate from Catalina 22. Not treated as evidence for Q5051252."
        }
      ],
      "generation_boundary_established_for_this_pilot": false,
      "generation_boundary_rationale": "A real, dated, textually-described generation redesign (markII, 1995-01) is positively evidenced, which is sufficient under IDENTITY_MODEL.v0.2.md 2.4 to treat 'Catalina 22' as spanning at least two BoatDesign generations. However, the bounded pass could not obtain markII-specific numeric specifications, so it cannot positively establish WHICH generation the retained SLICE-0028 Wikidata candidate values describe. This is reported as an unresolved boundary (GENERATION_AMBIGUOUS for the affected fields), not a false-negative absence claim -- the redesign itself is confirmed; its dimensional consequence for these five fields is not.",
      "design_option_axis_evidence": [
        {
          "axis": "draft",
          "evidence": "22Sport brochure: 'Draft, board up 0.51m 1'-8\"' and 'Draft, board down 1.52m 5'-0\"' -- a swing/centerboard keel with two concurrent, factory-documented draft states on the same hull, matching IDENTITY_MODEL.v0.2.md 2.5's explicit DesignOption 'draft' axis and its 'fixed vs lifting keel' example."
        }
      ],
      "dated_primary_source_documents": [],
      "applicability_scope": {
        "schema_version": "0.1",
        "first_year": null,
        "last_year": null,
        "hull_number_from": null,
        "hull_number_to": null,
        "market_or_region": null,
        "named_variant_hint": null,
        "design_option_hints": null,
        "operating_state_hint": null,
        "individual_hull_or_listing_ref": null,
        "unknown_or_unbounded": true
      }
    },
    {
      "qid": "Q5051253",
      "hullq_id": "BM_WDT0_3fdd058699d145c6a1b044fc90b65201",
      "preferred_label": "Catalina 30",
      "production_span_evidence": {
        "first_built": "1974-12",
        "last_built": null,
        "evidence": "Official history page: 'December 1974 -- Catalina's third model, the Catalina 30, is introduced; the trend-setting design is an immediate sales success...'. Hull-number milestone: 'October 1987 -- Catalina 30 hull number 5,000 is completed. Catalina 30s are being built at the East and West Coast plants, as well as in Canada...'. last_built is not evidenced by the bounded pass."
      },
      "candidate_generation_boundaries": [
        {
          "label": "Catalina 30 MKI (archive link label only)",
          "boundary_date": null,
          "evidence_class": "archive_label_uncorroborated_by_dated_history_entry",
          "evidence": "The official brochure-archives/ index links one scanned document with the anchor text 'Catalina 30 MKI brochure' (C-30-MK-I-Brochure.pdf), distinct from a second, undated 'Cat-30 brochure' (brochure-C-30.pdf). The official history/ timeline (retrieval 11) contains no 'Mk' or generation-numbered entry for Catalina 30 anywhere -- in contrast, the same timeline explicitly logs dated Mark II-style redesigns for FOUR sibling models: Catalina 22 (January 1995, 're-designed and enlarged deck and new interior'), Catalina 36 Mark II (March 1995), Catalina 28 Mark II (March 1996) and Catalina 34 MarkII (February 1996, 're-designed and enlarged deck, transom and interior'). Given the company's own demonstrated practice of dating and naming such redesigns for its other successful models, the total absence of an equivalent Catalina-30 entry is treated as WEAK supporting context, not proof, that no comparable hull/deck redesign occurred.",
          "identity_model_criterion_matched": "Archive-side generation label only (IDENTITY_MODEL.v0.2.md 2.4 'manufacturer generation label such as Mk II' is SHOULD-level applicability metadata), not independently corroborated by a dated redesign statement in the same manufacturer's own history page. No IDENTITY_MODEL.v0.2.md 2.4 BoatDesign-split trigger (materially different hull form/tooling, an evidence-backed redesign, a persistent non-optional field-affecting change with an identifiable boundary, or an unrelated reused-name design) was found for Catalina 30 in this bounded pass.",
          "dimensional_impact_on_five_tier1_fields": "No difference found in LOA/LWL/beam/displacement(std)/lead(std) between the two retrieved Catalina 30 documents (see below).",
          "caution": "Per the no-absence-as-proof rule, the absence of a located 'MK II' document does not prove one does not exist, and the absence of a company-history redesign entry does not prove no redesign occurred; this label is retained as an open, unresolved naming signal, not as a confirmed second generation."
        }
      ],
      "excluded_related_products": [],
      "generation_boundary_established_for_this_pilot": true,